{
  "id": "vampire-hunter",
  "kind": "race",
  "name": "Vampire Hunter",
  "summary": "A Human sub-race earned by quest, armed with blades and the old vampire-killer's moves.",
  "trust": "unconfirmed",
  "sources": [
    "wiki-vampire-hunter",
    "wiki-human"
  ],
  "last_updated": "2026-10-27",
  "category": "variant",
  "parent": "human",
  "origin": "earned",
  "type_line": "Sub-race of Humans, earned by quest",
  "abilities": [
    {
      "name": "Neck Snap",
      "effect": "Unlocked by completing the quest."
    },
    {
      "name": "Barrage",
      "effect": "Unlocked by completing the quest."
    }
  ],
  "sections": [
    {
      "heading": "Gear",
      "body": "- [[throwing-knife]]: the quest reward, and sold only to Vampire Hunters\n- [[rapier]]: from the [[weapons-shop]]"
    }
  ],
  "tbc": [
    "abilities.key",
    "abilities.cooldown"
  ]
}
