{
  "id": "werewolf",
  "kind": "race",
  "name": "Werewolf",
  "summary": "A race you catch, not choose: a scratch, a 5% chance, and the next full moon.",
  "trust": "unconfirmed",
  "sources": [
    "wiki-werewolf",
    "itzvexo-werewolf",
    "discord-2026-10-15"
  ],
  "last_updated": "2026-10-27",
  "category": "playable",
  "origin": "turned",
  "type_line": "Turned, not born",
  "blood": "No blood meter. Hunger is fed by eating the bodies of the dead with the devour action.",
  "abilities": [
    {
      "name": "Howl",
      "effect": "Summons other werewolves."
    },
    {
      "name": "Poisoned claws",
      "starting": true,
      "effect": "Any werewolf attack poisons vampires.",
      "works_on": [
        {
          "race": "vampire",
          "works": true,
          "trust": "unconfirmed"
        }
      ]
    },
    {
      "name": "Bite",
      "effect": "Werewolves cannot bite Originals.",
      "works_on": [
        {
          "race": "original-vampire",
          "works": false,
          "trust": "unconfirmed"
        }
      ]
    },
    {
      "name": "Devour",
      "effect": "Eat a body lying on the ground to sate your hunger."
    },
    {
      "name": "Fatal attacks",
      "effect": "Added 15 October 2026."
    }
  ],
  "strengths": [
    "The strongest werewolf on the server wears the **Alpha** tag: a 20% buff",
    "Stays in full wolf form with the [[werewolf-ring]]",
    "Stronger during a [[blood-moon]]"
  ],
  "weaknesses": [
    "Cannot bite [[original-vampire|Originals]]"
  ],
  "clan": {
    "name": "Pack",
    "body": "Werewolves run in packs, as vampires keep bloodlines and witches covens."
  },
  "sections": [
    {
      "heading": "Forms",
      "body": "A werewolf has a normal player form and a full wolf form. The [[werewolf-ring]] keeps you in full wolf form for good."
    },
    {
      "heading": "15 October 2026",
      "body": "- The Alpha tag (+20%) for the strongest werewolf on the server\n- More than 20 new werewolf skins\n- Every werewolf attack poisons vampires\n- Howl summons other werewolves\n- Shorter cooldowns, and fatal attacks"
    }
  ],
  "tbc": [
    "daylight",
    "abilities.key",
    "abilities.level",
    "abilities.cooldown"
  ]
}
